{
  "schema_version": "lane_prompt_audit_v1",
  "stable_sources": [
    {"path":"Dashboard/Artifacts/Stage-Plan-SP-003/SP003_OpenSourceDistributionArchitecture_GoalContract.json","sha256":"a7910428c9fb0832609a96fd403d0a46df7da32c87139c86a5f4548a7bb51421"},
    {"path":"Dashboard/Artifacts/Stage-Plan-SP-003/SP003_OpenSourceDistributionArchitecture_StagePlan.md","sha256":"09d400afc9d733dff93c3d77d56a9dd94a3ab9e1af29ca81c0731748e123a5cd"},
    {"path":"Dashboard/Artifacts/Stage-Plan-SP-003/SP003_S016_Design.md","sha256":"5268573cafaf0f54f1a526a0419df7e0e3d607573c0832a6290ed78b9998296e"},
    {"path":"Dashboard/Artifacts/Stage-Plan-SP-003/SP003_S016_ERBE_Contract.json","sha256":"1d9de9aa6a91fc9a8ff8450e3d045dc7fa047477595ee95097b1e29fcfea296d"},
    {"path":"Dashboard/Artifacts/Stage-Plan-SP-003/SP003_S016_SemanticReview.md","sha256":"d90e71a16c5dc89f6283251ac1e59e868f8f4ee760977b14246bdcf18d96e504"}
  ],
  "prompts": [
    {"lane":"S-016 design","source_type":"prompt_artifact","path":"Dashboard/Artifacts/Stage-Plan-SP-003/SP003_S016_DesignLanePrompt.txt","sha256":"6518e4dd963da6e1ac62f7ff97f4d85637e5a4018aa0ccabe73003dc243a5102"},
    {"lane":"S-016 semantic","source_type":"prompt_artifact","path":"Dashboard/Artifacts/Stage-Plan-SP-003/SP003_S016_SemanticLanePrompt.txt","sha256":"a4eb61b02fe2c81f4fccf2d64e0dd92d5bcb38d74a62cdc44af88a6ac639b63d"},
    {"lane":"S-016 validation","source_type":"prompt_artifact","path":"Dashboard/Artifacts/Stage-Plan-SP-003/SP003_S016_ValidationLanePrompt.txt","sha256":"3b162d21c29481f5fb4164eb062f472ebc82046c8ad279540d6d6acc274146fd"},
    {"lane":"S-016 closure","source_type":"prompt_artifact","path":"Dashboard/Artifacts/Stage-Plan-SP-003/SP003_S016_ClosureLanePrompt.txt","sha256":"d594bd30b34b66e6fbf22e14a506b2d92e671b274e64f6e2b39b68f3fb941d3a"},
    {"lane":"S-017 builder","source_type":"prompt_artifact","path":"Dashboard/Artifacts/Stage-Plan-SP-003/SP003_S017_BuilderLanePrompt.txt","sha256":"7e8e3dca24a0e47854a9b4ace935b71461ad3d0e68cb0c9cbae1562d409fc746"}
  ],
  "allowed_boilerplate": []
}
