{
  "schema_version": "lane_prompt_audit_v1",
  "stable_sources": [
    {"path": "Dashboard/Artifacts/SP001_SGEGovernanceMigration_LoopGoal.md", "sha256": "1640f82c57abdd424e9aa36cebb4e6e9f2bde12bfdbbc0f6738a5aae00eab974"},
    {"path": "Dashboard/Artifacts/SP001_QualityRecovery_ContextBootstrap.json", "sha256": "428d1dfd5e45b431cd158212607284ad08f2413793c60c92353eba393f8b69cb"},
    {"path": "Dashboard/Artifacts/SP001_QualityRecovery_ERBE_Contract.json", "sha256": "56789c7d7ab64b5f453eb94a7f9c134aff4b9e28ebb2e23f04b2ffa32d5f9ae3"},
    {"path": "Dashboard/Artifacts/SP001_QualityRecovery_ERBE_Cases.json", "sha256": "39bd8502b7677450e7739df719190aacb5e2e0f19d42fb95eabae1a326405642"}
  ],
  "prompts": [
    {"lane": "active-public 身份与 registry 修复设计审计", "source_type": "prompt_artifact", "path": "Dashboard/Artifacts/SP001_S012_IdentityRegistry_LanePrompt.txt", "sha256": "45a5e3bb3362ea44803ef9d4a33a7a5dd950ffc78e1e954f96a827f8e9af5bb1"},
    {"lane": "semantic-governance canonical 来源逐节审计", "source_type": "prompt_artifact", "path": "Dashboard/Artifacts/SP001_S013_SourceAudit_LanePrompt.txt", "sha256": "b2f8891e0fad489602e88dc0e1ee8f6f78ca84b253f373024c063176cc11e6e2"},
    {"lane": "引用、KB-DKG 与 doctor 工具链设计", "source_type": "prompt_artifact", "path": "Dashboard/Artifacts/SP001_S014_ToolchainDesign_LanePrompt.txt", "sha256": "71a923547df77d78da127ce3218a8b7134252055f75187bb0b8f456448c7274e"}
  ],
  "allowed_boilerplate": []
}
