{
  "schema_version": "lane_prompt_audit_v1",
  "stable_sources": [
    {"path":"Dashboard/Artifacts/RepositoryCapabilityPanorama_ContextBootstrap.json","sha256":"8cb87163020447a1748ad839c48ca5de76d359da5cb3837497df16a2ac8aada5"},
    {"path":"Dashboard/Artifacts/RepositoryQualityPanorama_Audit_Design.md","sha256":"46ab2e4689423f762cc7b691bd0afdc8c48edb3f2f7001225b9e2eef9c32e432"}
  ],
  "prompts": [
    {"lane":"panorama design","source_type":"prompt_artifact","path":"Dashboard/Artifacts/RepositoryCapabilityPanorama_DesignLanePrompt.txt","sha256":"aed4a83f8374c03e8faa79dbd5bb1ba6b1495574a80ccb8cd599acac4a02d5b4"},
    {"lane":"capability audit","source_type":"prompt_artifact","path":"Dashboard/Artifacts/RepositoryCapabilityPanorama_CapabilityAuditLanePrompt.txt","sha256":"bbaf0b439c60e128c2ad9a84c8e25919348e6f85ec49337071d483ec3cafa5e4"},
    {"lane":"public audit","source_type":"prompt_artifact","path":"Dashboard/Artifacts/RepositoryCapabilityPanorama_PublicAuditLanePrompt.txt","sha256":"718fdc6fdcc7a11aafe2b285f2b2a07d0a33c08f5f3f4afc750eab35b50984bc"},
    {"lane":"panorama builder","source_type":"prompt_artifact","path":"Dashboard/Artifacts/RepositoryCapabilityPanorama_BuilderLanePrompt.txt","sha256":"16fefec17161e814be2d61bc5cc401328f3cdb2ff0c2c6afd06633002ef4930b"},
    {"lane":"panorama closure","source_type":"prompt_artifact","path":"Dashboard/Artifacts/RepositoryCapabilityPanorama_ClosureLanePrompt.txt","sha256":"a593323055e4913248c0f2f4535cdbdbf26d8dcc2a5f69534c4cdf466be3e3c4"},
    {"lane":"panorama final validation","source_type":"prompt_artifact","path":"Dashboard/Artifacts/RepositoryCapabilityPanorama_ValidationLanePrompt.txt","sha256":"eef687ba1c66a738ee83358d1c9628a654b87a271c04fc333e9abbc7e51abfd2"}
  ],
  "allowed_boilerplate": []
}
