{
  "schema_version":"lane_prompt_audit_v1",
  "stable_sources":[
    {"path":"Dashboard/Artifacts/RepositoryQualityPanorama_Audit_Design.md","sha256":"46ab2e4689423f762cc7b691bd0afdc8c48edb3f2f7001225b9e2eef9c32e432"},
    {"path":"Dashboard/Artifacts/RepositoryQualityPanorama_ContextBootstrap.json","sha256":"8e1ca9de54e6409161ef7c8f847c1381693e174912bed47cbcb484679f82598b"}
  ],
  "prompts":[
    {"lane":"公共仓库身份与残留审计","source_type":"prompt_artifact","path":"Dashboard/Artifacts/RepositoryQualityPanorama_PublicResidue_LanePrompt.txt","sha256":"e9313a0ad80cf9bf3d6ec74a2cead7da112442cb0698380a40a41084e1c24fa0"},
    {"lane":"SP-001 Session 与 artifact 完整性审计","source_type":"prompt_artifact","path":"Dashboard/Artifacts/RepositoryQualityPanorama_SP001_LanePrompt.txt","sha256":"77efb58000828a901ea992bf0b7fec22b7287cbad4be07d6ecc90bdef8fefd98"},
    {"lane":"引用完整性与其他一致性审计","source_type":"prompt_artifact","path":"Dashboard/Artifacts/RepositoryQualityPanorama_References_LanePrompt.txt","sha256":"0a3c985c49301e6047822318766d392f90ebb182f2905b0cc99b33c90813a71d"}
  ],
  "allowed_boilerplate":[]
}
